{
  "intent_iri":"https://example.org/authority/intent-1",
  "work_order_iri":"https://example.org/engineering/work-001",
  "capability_iri":"https://example.org/engineering/root-refactor-capability",
  "graph_digest":"0000000000000000000000000000000000000000000000000000000000000000",
  "repository_identity":"seanchatmangpt/engineering-standards",
  "base_sha":"610944c48bce6377291c088a3e07775e9ef2908b",
  "requested_authority":"DO",
  "principal_iri":"https://example.org/principal/operator",
  "policy_iri":"https://example.org/policy/root",
  "replay_identity":"engineering-standards:root:v26.9.21",
  "requested_consequence":"publish candidate branch update"
}
